[
  {
    "id": "CR_B2_MC_CLOZE_REPAIR_TABLE",
    "level": "B2",
    "archetype": "mc-cloze",
    "title": "A Saturday at the Repair Table",
    "mainTextWithPlaceholders": "Our neighbourhood repair table began with three folding chairs and a box of borrowed tools. Visitors bring lamps, radios, and small household objects that have {{1}} working. The volunteers do not simply fix each item; they invite its owner to inspect the problem with them. This approach takes longer, but it gives people the confidence to attempt simple repairs {{2}} their own. Last month, the group saved forty-two objects from being thrown away. It also collected short notes about the most common faults, {{3}} future workshops could focus on useful skills. The organisers are careful not to promise that every object can be rescued. Even so, owners often leave satisfied because they understand {{4}} went wrong and what to check next time.",
    "learningObjectives": [
      "Select verbs and connectors from grammatical and collocational context",
      "Use local cohesion to distinguish plausible distractors"
    ],
    "questions": [
      {
        "questionNumber": 1,
        "placeholder": "{{1}}",
        "options": [
          { "letter": "A", "text": "stopped", "isCorrect": true, "feedback": "‘Stopped working’ is the natural verb pattern for a device that no longer functions." },
          { "letter": "B", "text": "closed", "isCorrect": false, "feedback": "‘Closed’ does not combine with ‘working’ in this meaning." },
          { "letter": "C", "text": "paused", "isCorrect": false, "feedback": "A device can pause, but ‘paused working’ is not the intended construction." },
          { "letter": "D", "text": "ended", "isCorrect": false, "feedback": "‘Ended working’ is not idiomatic here." }
        ]
      },
      {
        "questionNumber": 2,
        "placeholder": "{{2}}",
        "options": [
          { "letter": "A", "text": "by", "isCorrect": false, "feedback": "‘By their own’ is incomplete; it would require a different phrase." },
          { "letter": "B", "text": "on", "isCorrect": true, "feedback": "‘On their own’ means independently." },
          { "letter": "C", "text": "from", "isCorrect": false, "feedback": "‘From their own’ does not form the fixed expression." },
          { "letter": "D", "text": "with", "isCorrect": false, "feedback": "‘With their own’ would need a following noun." }
        ]
      },
      {
        "questionNumber": 3,
        "placeholder": "{{3}}",
        "options": [
          { "letter": "A", "text": "unless", "isCorrect": false, "feedback": "The sentence expresses a result or purpose, not an exception." },
          { "letter": "B", "text": "whereas", "isCorrect": false, "feedback": "No contrast is being drawn between two facts." },
          { "letter": "C", "text": "so", "isCorrect": true, "feedback": "‘So’ connects the collected evidence to its intended practical use." },
          { "letter": "D", "text": "although", "isCorrect": false, "feedback": "The second clause does not concede or contradict the first." }
        ]
      },
      {
        "questionNumber": 4,
        "placeholder": "{{4}}",
        "options": [
          { "letter": "A", "text": "that", "isCorrect": false, "feedback": "‘That’ cannot ask about the cause in this embedded clause." },
          { "letter": "B", "text": "which", "isCorrect": false, "feedback": "There is no defined set of alternatives for ‘which’ to select from." },
          { "letter": "C", "text": "how", "isCorrect": false, "feedback": "‘How went wrong’ is not grammatical." },
          { "letter": "D", "text": "what", "isCorrect": true, "feedback": "‘What went wrong’ is the correct embedded question." }
        ]
      }
    ]
  },
  {
    "id": "CR_B1_OPEN_CLOZE_SEED_SHELF",
    "level": "B1",
    "archetype": "open-cloze",
    "title": "The Seed Shelf",
    "mainTextWithPlaceholders": "A small shelf appeared beside the entrance to Brook Lane Library in March. It was full {{1}} packets of vegetable and flower seeds. Anyone could take a packet, provided that they promised to return some seeds after the plants had grown. At first, the librarians were not sure {{2}} the idea would work. Within two weeks, however, every packet had found a home. Local gardeners then began adding labels with simple advice, such as how much sunlight each plant needed. The shelf has become more {{3}} a place to exchange seeds: people now leave notes offering spare pots or help to new gardeners. There is no membership form, {{4}} participants are asked to take only what they can use.",
    "learningObjectives": [
      "Complete common fixed phrases with function words",
      "Use clause meaning to choose a conjunction"
    ],
    "questions": [
      { "questionNumber": 1, "placeholder": "{{1}}", "correctAnswers": ["of"], "explanation": "The fixed phrase is ‘full of’." },
      { "questionNumber": 2, "placeholder": "{{2}}", "correctAnswers": ["whether", "if"], "explanation": "An indirect yes-or-no question can use ‘whether’ or ‘if’." },
      { "questionNumber": 3, "placeholder": "{{3}}", "correctAnswers": ["than"], "explanation": "The expression ‘more than’ shows that the shelf now has an additional social role." },
      { "questionNumber": 4, "placeholder": "{{4}}", "correctAnswers": ["but"], "explanation": "‘But’ contrasts the absence of a form with the presence of a request." }
    ]
  },
  {
    "id": "CR_C1_WORD_FORMATION_NIGHT_MAP",
    "level": "C1",
    "archetype": "word-formation",
    "title": "Mapping a City After Dark",
    "mainTextWithPlaceholders": "A university team asked residents to record how they moved through the city after dark. The researchers were interested not only in {{1}}, but also in whether public spaces felt welcoming. Participants used a simple map to mark bright routes, quiet corners, and places where signs were {{2}}. The project produced several {{3}} findings. For example, a well-lit path was not always the preferred route if it felt isolated. City planners have since added evening walks to their consultation process, giving residents a more {{4}} role in decisions about lighting and transport.",
    "learningObjectives": [
      "Form context-appropriate nouns and adjectives",
      "Use suffixes and prefixes while preserving meaning"
    ],
    "questions": [
      { "questionNumber": 1, "placeholder": "{{1}}", "questionText": "SAFE", "correctAnswers": ["safety"], "explanation": "A noun is needed after the preposition ‘in’." },
      { "questionNumber": 2, "placeholder": "{{2}}", "questionText": "CLEAR", "correctAnswers": ["unclear"], "explanation": "The context describes signs that were difficult to understand, so a negative adjective is required." },
      { "questionNumber": 3, "placeholder": "{{3}}", "questionText": "EXPECT", "correctAnswers": ["unexpected"], "explanation": "An adjective meaning ‘not anticipated’ modifies ‘findings’." },
      { "questionNumber": 4, "placeholder": "{{4}}", "questionText": "ACT", "correctAnswers": ["active"], "explanation": "An adjective is needed before ‘role’." }
    ]
  },
  {
    "id": "CR_C2_KEYWORD_TRANSFORMATION_SHARED_STUDIO",
    "level": "C2",
    "archetype": "keyword-transformation",
    "title": "A Shared Studio",
    "mainTextWithPlaceholders": "Rewrite each sentence so that it keeps the original meaning. Use the supplied word without changing it. Each answer should contain three to ten words.",
    "learningObjectives": [
      "Recast meaning through advanced grammatical structures",
      "Maintain register and emphasis while respecting a word constraint"
    ],
    "questions": [
      {
        "questionNumber": 1,
        "placeholder": "{{1}}",
        "questionText": "SOONER",
        "originalSentence": "I would prefer the studio to publish the timetable today rather than wait until Friday.",
        "transformationSentence": "I would {{1}} wait until Friday.",
        "correctAnswers": ["sooner have the studio publish the timetable today than"],
        "explanation": "‘Would sooner … than …’ expresses a strong preference between two actions."
      },
      {
        "questionNumber": 2,
        "placeholder": "{{2}}",
        "questionText": "ACCOUNT",
        "originalSentence": "The committee did not consider the extra ventilation costs when it set the fee.",
        "transformationSentence": "The committee failed {{2}} when it set the fee.",
        "correctAnswers": ["to take the extra ventilation costs into account"],
        "explanation": "‘Take something into account’ means to include it in a decision."
      },
      {
        "questionNumber": 3,
        "placeholder": "{{3}}",
        "questionText": "BUT",
        "originalSentence": "The launch succeeded only because volunteers worked throughout the weekend.",
        "transformationSentence": "{{3}}, the launch would not have succeeded.",
        "correctAnswers": ["But for the volunteers working throughout the weekend", "But for the volunteers' work throughout the weekend"],
        "explanation": "‘But for’ introduces the condition whose absence would have changed the past result."
      },
      {
        "questionNumber": 4,
        "placeholder": "{{4}}",
        "questionText": "LITTLE",
        "originalSentence": "The organisers did not expect the evening sessions to be so popular.",
        "transformationSentence": "Little {{4}} so popular.",
        "correctAnswers": ["did the organisers expect the evening sessions to be"],
        "explanation": "Fronting ‘little’ for emphasis requires subject-auxiliary inversion."
      }
    ]
  },
  {
    "id": "CR_B2_READING_MCQ_SOUND_WALK",
    "level": "B2",
    "archetype": "reading-mcq",
    "title": "Listening to the Town",